{
  "configuration": {
    "optimizations": [],
    "pipeline": "compute",
    "resolution": 128,
    "scene_type": "tunnels",
    "screen_height": 1080,
    "screen_width": 1920,
    "shader": "VoxelRayMarch.comp"
  },
  "device": {
    "bandwidth_estimated": true,
    "driver": "0.405.548",
    "gpu": "Intel(R) RaptorLake-S Mobile Graphics Controller",
    "vram_gb": 15.8349609375
  },
  "frames": [
    {
      "avg_voxels_per_ray": 0.5385460257530212,
      "bandwidth_read_gbps": 6.5134501457214355,
      "bandwidth_write_gbps": 0.2914068102836609,
      "fps": 35.13296127319336,
      "frame_num": 100,
      "frame_time_ms": 28.463300704956055,
      "ray_throughput_mrays": 77.7294921875,
      "vram_mb": 177
    },
    {
      "avg_voxels_per_ray": 0.5385460257530212,
      "bandwidth_read_gbps": 6.783843040466309,
      "bandwidth_write_gbps": 0.30350399017333984,
      "fps": 36.591434478759766,
      "frame_num": 101,
      "frame_time_ms": 27.328800201416016,
      "gpu_power_w": 32,
      "gpu_temperature_c": 49,
      "gpu_utilization": 0,
      "memory_utilization": 0,
      "ray_throughput_mrays": 77.56034088134766,
      "vram_mb": 177
    },
    {
      "avg_voxels_per_ray": 0.5385460257530212,
      "bandwidth_read_gbps": 6.855283260345459,
      "bandwidth_write_gbps": 0.3067001700401306,
      "fps": 36.976776123046875,
      "frame_num": 102,
      "frame_time_ms": 27.04400062561035,
      "gpu_power_w": 28,
      "gpu_temperature_c": 49,
      "gpu_utilization": 0,
      "memory_utilization": 0,
      "ray_throughput_mrays": 77.44538116455078,
      "vram_mb": 177
    },
    {
      "avg_voxels_per_ray": 0.5385460257530212,
      "bandwidth_read_gbps": 6.6748857498168945,
      "bandwidth_write_gbps": 0.29862934350967407,
      "fps": 36.00373077392578,
      "frame_num": 103,
      "frame_time_ms": 27.774900436401367,
      "gpu_power_w": 28,
      "gpu_temperature_c": 51,
      "gpu_utilization": 0,
      "memory_utilization": 0,
      "ray_throughput_mrays": 77.53179931640625,
      "vram_mb": 177
    },
    {
      "avg_voxels_per_ray": 0.5385460257530212,
      "bandwidth_read_gbps": 6.632547378540039,
      "bandwidth_write_gbps": 0.29673513770103455,
      "fps": 35.775360107421875,
      "frame_num": 104,
      "frame_time_ms": 27.952199935913086,
      "gpu_power_w": 28,
      "gpu_temperature_c": 51,
      "gpu_utilization": 0,
      "memory_utilization": 0,
      "ray_throughput_mrays": 77.57864379882813,
      "vram_mb": 177
    },
    {
      "avg_voxels_per_ray": 0.5385460257530212,
      "bandwidth_read_gbps": 6.447958946228027,
      "bandwidth_write_gbps": 0.2884767949581146,
      "fps": 34.77970504760742,
      "frame_num": 105,
      "frame_time_ms": 28.752399444580078,
      "gpu_power_w": 28,
      "gpu_temperature_c": 51,
      "gpu_utilization": 0,
      "memory_utilization": 0,
      "ray_throughput_mrays": 79.97396850585938,
      "vram_mb": 177
    },
    {
      "avg_voxels_per_ray": 0.5385460257530212,
      "bandwidth_read_gbps": 6.42725944519043,
      "bandwidth_write_gbps": 0.2875507175922394,
      "fps": 34.668052673339844,
      "frame_num": 106,
      "frame_time_ms": 28.844999313354492,
      "gpu_power_w": 28,
      "gpu_temperature_c": 51,
      "gpu_utilization": 0,
      "memory_utilization": 0,
      "ray_throughput_mrays": 79.9797592163086,
      "vram_mb": 177
    },
    {
      "avg_voxels_per_ray": 0.5385460257530212,
      "bandwidth_read_gbps": 6.415427207946777,
      "bandwidth_write_gbps": 0.28702133893966675,
      "fps": 34.60423278808594,
      "frame_num": 107,
      "frame_time_ms": 28.8981990814209,
      "gpu_power_w": 28,
      "gpu_temperature_c": 51,
      "gpu_utilization": 0,
      "memory_utilization": 0,
      "ray_throughput_mrays": 77.70476531982422,
      "vram_mb": 177
    },
    {
      "avg_voxels_per_ray": 0.5385460257530212,
      "bandwidth_read_gbps": 6.3860578536987305,
      "bandwidth_write_gbps": 0.28570738434791565,
      "fps": 34.44581985473633,
      "frame_num": 108,
      "frame_time_ms": 29.031099319458008,
      "gpu_power_w": 28,
      "gpu_temperature_c": 51,
      "gpu_utilization": 0,
      "memory_utilization": 0,
      "ray_throughput_mrays": 77.51005554199219,
      "vram_mb": 177
    },
    {
      "avg_voxels_per_ray": 0.5385460257530212,
      "bandwidth_read_gbps": 6.3782806396484375,
      "bandwidth_write_gbps": 0.2853594422340393,
      "fps": 34.403865814208984,
      "frame_num": 109,
      "frame_time_ms": 29.066499710083008,
      "gpu_power_w": 28,
      "gpu_temperature_c": 51,
      "gpu_utilization": 0,
      "memory_utilization": 0,
      "ray_throughput_mrays": 76.84180450439453,
      "vram_mb": 177
    },
    {
      "avg_voxels_per_ray": 0.5385460257530212,
      "bandwidth_read_gbps": 6.53038215637207,
      "bandwidth_write_gbps": 0.2921643555164337,
      "fps": 35.22429275512695,
      "frame_num": 110,
      "frame_time_ms": 28.38949966430664,
      "gpu_power_w": 28,
      "gpu_temperature_c": 51,
      "gpu_utilization": 0,
      "memory_utilization": 0,
      "ray_throughput_mrays": 77.48320770263672,
      "vram_mb": 177
    },
    {
      "avg_voxels_per_ray": 0.5385460257530212,
      "bandwidth_read_gbps": 6.488692760467529,
      "bandwidth_write_gbps": 0.2902992069721222,
      "fps": 34.99942398071289,
      "frame_num": 111,
      "frame_time_ms": 28.5718994140625,
      "gpu_power_w": 28,
      "gpu_temperature_c": 51,
      "gpu_utilization": 0,
      "memory_utilization": 0,
      "ray_throughput_mrays": 77.33241271972656,
      "vram_mb": 177
    },
    {
      "avg_voxels_per_ray": 0.5385460257530212,
      "bandwidth_read_gbps": 6.507962703704834,
      "bandwidth_write_gbps": 0.29116129875183105,
      "fps": 35.10335922241211,
      "frame_num": 112,
      "frame_time_ms": 28.487300872802734,
      "gpu_power_w": 28,
      "gpu_temperature_c": 51,
      "gpu_utilization": 0,
      "memory_utilization": 0,
      "ray_throughput_mrays": 76.66527557373047,
      "vram_mb": 177
    },
    {
      "avg_voxels_per_ray": 0.5385460257530212,
      "bandwidth_read_gbps": 6.527462005615234,
      "bandwidth_write_gbps": 0.29203370213508606,
      "fps": 35.20853805541992,
      "frame_num": 113,
      "frame_time_ms": 28.40220069885254,
      "gpu_power_w": 28,
      "gpu_temperature_c": 51,
      "gpu_utilization": 0,
      "memory_utilization": 0,
      "ray_throughput_mrays": 77.5975341796875,
      "vram_mb": 177
    },
    {
      "avg_voxels_per_ray": 0.5385460257530212,
      "bandwidth_read_gbps": 6.4837236404418945,
      "bandwidth_write_gbps": 0.29007688164711,
      "fps": 34.972618103027344,
      "frame_num": 114,
      "frame_time_ms": 28.593799591064453,
      "gpu_power_w": 28,
      "gpu_temperature_c": 51,
      "gpu_utilization": 0,
      "memory_utilization": 0,
      "ray_throughput_mrays": 77.72721099853516,
      "vram_mb": 177
    },
    {
      "avg_voxels_per_ray": 0.5385460257530212,
      "bandwidth_read_gbps": 6.551220417022705,
      "bandwidth_write_gbps": 0.2930966317653656,
      "fps": 35.33668899536133,
      "frame_num": 115,
      "frame_time_ms": 28.2992000579834,
      "gpu_power_w": 28,
      "gpu_temperature_c": 51,
      "gpu_utilization": 0,
      "memory_utilization": 0,
      "ray_throughput_mrays": 77.29713439941406,
      "vram_mb": 177
    },
    {
      "avg_voxels_per_ray": 0.5385460257530212,
      "bandwidth_read_gbps": 6.53325891494751,
      "bandwidth_write_gbps": 0.2922930419445038,
      "fps": 35.23980712890625,
      "frame_num": 116,
      "frame_time_ms": 28.37700080871582,
      "gpu_power_w": 28,
      "gpu_temperature_c": 51,
      "gpu_utilization": 0,
      "memory_utilization": 0,
      "ray_throughput_mrays": 77.33120727539063,
      "vram_mb": 177
    },
    {
      "avg_voxels_per_ray": 0.5385460257530212,
      "bandwidth_read_gbps": 6.508031368255615,
      "bandwidth_write_gbps": 0.2911643981933594,
      "fps": 35.10373306274414,
      "frame_num": 117,
      "frame_time_ms": 28.48699951171875,
      "gpu_power_w": 28,
      "gpu_temperature_c": 51,
      "gpu_utilization": 0,
      "memory_utilization": 0,
      "ray_throughput_mrays": 77.76258850097656,
      "vram_mb": 177
    },
    {
      "avg_voxels_per_ray": 0.5385460257530212,
      "bandwidth_read_gbps": 6.514113903045654,
      "bandwidth_write_gbps": 0.2914365231990814,
      "fps": 35.136539459228516,
      "frame_num": 118,
      "frame_time_ms": 28.460399627685547,
      "gpu_power_w": 28,
      "gpu_temperature_c": 51,
      "gpu_utilization": 0,
      "memory_utilization": 0,
      "ray_throughput_mrays": 77.83434295654297,
      "vram_mb": 177
    },
    {
      "avg_voxels_per_ray": 0.5385460257530212,
      "bandwidth_read_gbps": 6.5162200927734375,
      "bandwidth_write_gbps": 0.2915307581424713,
      "fps": 35.14790344238281,
      "frame_num": 119,
      "frame_time_ms": 28.451200485229492,
      "gpu_power_w": 28,
      "gpu_temperature_c": 51,
      "gpu_utilization": 0,
      "memory_utilization": 0,
      "ray_throughput_mrays": 77.74057006835938,
      "vram_mb": 177
    },
    {
      "avg_voxels_per_ray": 0.5385460257530212,
      "bandwidth_read_gbps": 6.585076808929443,
      "bandwidth_write_gbps": 0.2946113646030426,
      "fps": 35.519309997558594,
      "frame_num": 120,
      "frame_time_ms": 28.15369987487793,
      "gpu_power_w": 28,
      "gpu_temperature_c": 51,
      "gpu_utilization": 0,
      "memory_utilization": 0,
      "ray_throughput_mrays": 77.82688903808594,
      "vram_mb": 177
    },
    {
      "avg_voxels_per_ray": 0.5385460257530212,
      "bandwidth_read_gbps": 6.606572151184082,
      "bandwidth_write_gbps": 0.29557302594184875,
      "fps": 35.63525390625,
      "frame_num": 121,
      "frame_time_ms": 28.06209945678711,
      "gpu_power_w": 29,
      "gpu_temperature_c": 51,
      "gpu_utilization": 0,
      "memory_utilization": 0,